{
  "id": "population",
  "title": "population total per year",
  "timeformat": "YYYY",
  "legend": {
    "t": "year",
    "v": "total inhabitants in the Country"
  },
  "values": [
    {
      "t": "1840",
      "v": 170500,
      "h": "HIGHLIGHT",
      "label": "counting start officially",
      "seeAlso": ["t01m01s01"]
    },
    {
      "t": "1841",
      "v": 173190
    },
    {
      "t": "1842",
      "v": 175981
    },
    {
      "t": "1843",
      "v": 177943
    },
    {
      "t": "1844",
      "v": 178207,
      "h": "PEAK",
      "label": "huge increment",
      "seeAlso": ["t01m01s02"]
    },
    {
      "t": "1845",
      "v": 180574
    },
    {
      "t": "1846",
      "v": 183431
    },
    {
      "t": "1847",
      "v": 185023
    },
    {
      "t": "1848",
      "v": 186053
    },
    {
      "t": "1849",
      "v": 186856,
      "h": "WARNING",
      "label": "incomplete data for this year",
      "seeAlso": ["t01m01s03"]
    },
    {
      "t": "1850",
      "v": 189965
    },
    {
      "t": "1851",
      "v": 192488
    },
    {
      "t": "1852",
      "v": 194769
    },
    {
      "t": "1853",
      "v": 193156
    },
    {
      "t": "1854",
      "v": 193117
    },
    {
      "t": "1855",
      "v": 189212
    },
    {
      "t": "1856",
      "v": 189562
    },
    {
      "t": "1857",
      "v": 190379
    },
    {
      "t": "1858",
      "v": 190237
    },
    {
      "t": "1859",
      "v": 191581
    },
    {
      "t": "1860",
      "v": 193822
    },
    {
      "t": "1861",
      "v": 196198
    },
    {
      "t": "1862",
      "v": 197910
    },
    {
      "t": "1863",
      "v": 199733
    },
    {
      "t": "1864",
      "v": 201894
    },
    {
      "t": "1865",
      "v": 203050
    },
    {
      "t": "1866",
      "v": 203697
    },
    {
      "t": "1867",
      "v": 200263
    },
    {
      "t": "1868",
      "v": 196855
    },
    {
      "t": "1869",
      "v": 199991
    },
    {
      "t": "1870",
      "v": 200659
    },
    {
      "t": "1871",
      "v": 202214
    },
    {
      "t": "1872",
      "v": 199994
    },
    {
      "t": "1873",
      "v": 200172
    },
    {
      "t": "1874",
      "v": 201363
    },
    {
      "t": "1875",
      "v": 203679
    },
    {
      "t": "1876",
      "v": 204599
    },
    {
      "t": "1877",
      "v": 206047
    },
    {
      "t": "1878",
      "v": 207439
    },
    {
      "t": "1879",
      "v": 208735
    },
    {
      "t": "1880",
      "v": 209342
    },
    {
      "t": "1881",
      "v": 210589
    },
    {
      "t": "1882",
      "v": 210959
    },
    {
      "t": "1883",
      "v": 212378
    },
    {
      "t": "1884",
      "v": 213464
    },
    {
      "t": "1885",
      "v": 214572
    },
    {
      "t": "1886",
      "v": 214595
    },
    {
      "t": "1887",
      "v": 215764
    },
    {
      "t": "1888",
      "v": 216235
    },
    {
      "t": "1889",
      "v": 215028
    },
    {
      "t": "1890",
      "v": 212834
    },
    {
      "t": "1891",
      "v": 211505
    },
    {
      "t": "1892",
      "v": 212594
    },
    {
      "t": "1893",
      "v": 213275
    },
    {
      "t": "1894",
      "v": 214397
    },
    {
      "t": "1895",
      "v": 216060
    },
    {
      "t": "1896",
      "v": 217910
    },
    {
      "t": "1897",
      "v": 220582
    },
    {
      "t": "1898",
      "v": 223692
    },
    {
      "t": "1899",
      "v": 227205
    },
    {
      "t": "1900",
      "v": 231567
    },
    {
      "t": "1901",
      "v": 234905
    },
    {
      "t": "1902",
      "v": 237219
    },
    {
      "t": "1903",
      "v": 240275
    },
    {
      "t": "1904",
      "v": 242408
    },
    {
      "t": "1905",
      "v": 244631
    },
    {
      "t": "1906",
      "v": 246411
    },
    {
      "t": "1907",
      "v": 249073
    },
    {
      "t": "1908",
      "v": 251709
    },
    {
      "t": "1909",
      "v": 254415
    },
    {
      "t": "1910",
      "v": 256927
    },
    {
      "t": "1911",
      "v": 259211
    },
    {
      "t": "1912",
      "v": 260754
    },
    {
      "t": "1913",
      "v": 263069
    },
    {
      "t": "1914",
      "v": 265495
    },
    {
      "t": "1915",
      "v": 265800
    },
    {
      "t": "1916",
      "v": 264795
    },
    {
      "t": "1917",
      "v": 263487
    },
    {
      "t": "1918",
      "v": 263276
    },
    {
      "t": "1919",
      "v": 262078
    },
    {
      "t": "1920",
      "v": 260969
    },
    {
      "t": "1921",
      "v": 260646
    },
    {
      "t": "1922",
      "v": 261236
    },
    {
      "t": "1923",
      "v": 261792
    },
    {
      "t": "1924",
      "v": 267299
    },
    {
      "t": "1925",
      "v": 272037
    },
    {
      "t": "1926",
      "v": 275675
    },
    {
      "t": "1927",
      "v": 280834
    },
    {
      "t": "1928",
      "v": 284879
    },
    {
      "t": "1929",
      "v": 289666
    },
    {
      "t": "1930",
      "v": 294723
    },
    {
      "t": "1931",
      "v": 299774
    },
    {
      "t": "1932",
      "v": 298827
    },
    {
      "t": "1933",
      "v": 297463
    },
    {
      "t": "1934",
      "v": 297513
    },
    {
      "t": "1935",
      "v": 297243
    },
    {
      "t": "1936",
      "v": 296906
    },
    {
      "t": "1937",
      "v": 298071
    },
    {
      "t": "1938",
      "v": 300730
    },
    {
      "t": "1939",
      "v": 301365
    },
    {
      "t": "1940",
      "v": 298952
    },
    {
      "t": "1941",
      "v": 292991
    },
    {
      "t": "1942",
      "v": 290225
    },
    {
      "t": "1943",
      "v": 289051
    },
    {
      "t": "1944",
      "v": 287891
    },
    {
      "t": "1945",
      "v": 282993
    },
    {
      "t": "1946",
      "v": 284463
    },
    {
      "t": "1947",
      "v": 287151
    },
    {
      "t": "1948",
      "v": 290991
    },
    {
      "t": "1949",
      "v": 292612
    },
    {
      "t": "1950",
      "v": 293822
    },
    {
      "t": "1951",
      "v": 295327
    },
    {
      "t": "1952",
      "v": 296457
    },
    {
      "t": "1953",
      "v": 297965
    },
    {
      "t": "1954",
      "v": 299523
    },
    {
      "t": "1955",
      "v": 301445
    },
    {
      "t": "1956",
      "v": 303586
    },
    {
      "t": "1957",
      "v": 305221
    },
    {
      "t": "1958",
      "v": 307724
    },
    {
      "t": "1959",
      "v": 310361
    },
    {
      "t": "1960",
      "v": 312641
    },
    {
      "t": "1961",
      "v": 314894
    },
    {
      "t": "1962",
      "v": 318796
    },
    {
      "t": "1963",
      "v": 322696
    },
    {
      "t": "1964",
      "v": 325499
    },
    {
      "t": "1965",
      "v": 330001
    },
    {
      "t": "1966",
      "v": 333001
    },
    {
      "t": "1967",
      "v": 334795
    },
    {
      "t": "1968",
      "v": 335233
    },
    {
      "t": "1969",
      "v": 336499
    },
    {
      "t": "1970",
      "v": 338499
    },
    {
      "t": "1971",
      "v": 339796
    },
    {
      "t": "1972",
      "v": 344946
    },
    {
      "t": "1973",
      "v": 348141
    },
    {
      "t": "1974",
      "v": 352639
    },
    {
      "t": "1975",
      "v": 357339
    },
    {
      "t": "1976",
      "v": 360441
    },
    {
      "t": "1977",
      "v": 360889
    },
    {
      "t": "1978",
      "v": 361689
    },
    {
      "t": "1979",
      "v": 362294
    },
    {
      "t": "1980",
      "v": 363447
    },
    {
      "t": "1981",
      "v": 364843
    },
    {
      "t": "1982",
      "v": 365592
    },
    {
      "t": "1983",
      "v": 365439
    },
    {
      "t": "1984",
      "v": 365535
    },
    {
      "t": "1985",
      "v": 366135
    },
    {
      "t": "1986",
      "v": 367182
    },
    {
      "t": "1987",
      "v": 369481
    },
    {
      "t": "1988",
      "v": 371707
    },
    {
      "t": "1989",
      "v": 374870
    },
    {
      "t": "1990",
      "v": 378408
    },
    {
      "t": "1991",
      "v": 383513
    },
    {
      "t": "1992",
      "v": 389600
    },
    {
      "t": "1993",
      "v": 394750
    },
    {
      "t": "1994",
      "v": 400200
    },
    {
      "t": "1995",
      "v": 405650
    },
    {
      "t": "1996",
      "v": 411610
    },
    {
      "t": "1997",
      "v": 416860
    },
    {
      "t": "1998",
      "v": 422060
    },
    {
      "t": "1999",
      "v": 427360
    },
    {
      "t": "2000",
      "v": 433610
    },
    {
      "t": "2001",
      "v": 439010
    },
    {
      "t": "2002",
      "v": 444060
    },
    {
      "t": "2003",
      "v": 448310
    },
    {
      "t": "2004",
      "v": 455010
    },
    {
      "t": "2005",
      "v": 461210
    },
    {
      "t": "2006",
      "v": 469110
    },
    {
      "t": "2007",
      "v": 476210
    },
    {
      "t": "2008",
      "v": 483822
    },
    {
      "t": "2009",
      "v": 493523
    },
    {
      "t": "2010",
      "v": 502089
    },
    {
      "t": "2011",
      "v": 512052
    },
    {
      "t": "2012",
      "v": 524664
    },
    {
      "t": "2013",
      "v": 536850
    },
    {
      "t": "2014",
      "v": 549491
    }
  ]
}
