{
  "id": "migratory-balance",
  "title": "Migratory balance per year",
  "timeformat": "YYYY",
  "legend": {
    "v": "Migratory balance"
  },
  "values": [
    {
      "t": "1840", "v": -20
    },
    {
      "t": "1841", "v": -120
    },
    {
      "t": "1842", "v": -150
    },
    {
      "t": "1843", "v": -1700
    },
    {
      "t": "1844", "v": -100
    },
    {
      "t": "1845", "v": -230
    },
    {
      "t": "1846", "v": -910
    },
    {
      "t": "1847", "v": -360
    },
    {
      "t": "1848", "v": -700
    },
    {
      "t": "1849", "v": 340
    },
    {
      "t": "1850", "v": -70
    },
    {
      "t": "1851", "v": -200
    },
    {
      "t": "1852", "v": -3800
    },
    {
      "t": "1853", "v": -1850
    },
    {
      "t": "1854", "v": -5510
    },
    {
      "t": "1855", "v": -1350
    },
    {
      "t": "1856", "v": -1590
    },
    {
      "t": "1857", "v": -2340
    },
    {
      "t": "1858", "v": -460
    },
    {
      "t": "1859", "v": -10
    },
    {
      "t": "1860", "v": -200
    },
    {
      "t": "1861", "v": -640
    },
    {
      "t": "1862", "v": -240
    },
    {
      "t": "1863", "v": -230
    },
    {
      "t": "1864", "v": -400
    },
    {
      "t": "1865", "v": -480
    },
    {
      "t": "1866", "v": -1910
    },
    {
      "t": "1867", "v": -5740
    },
    {
      "t": "1868", "v": -2150
    },
    {
      "t": "1869", "v": -1620
    },
    {
      "t": "1870", "v": -100
    },
    {
      "t": "1871", "v": -2660
    },
    {
      "t": "1872", "v": -1890
    },
    {
      "t": "1873", "v": -1150
    },
    {
      "t": "1874", "v": 120
    },
    {
      "t": "1875", "v": -20
    },
    {
      "t": "1876", "v": -1450
    },
    {
      "t": "1877", "v": -1660
    },
    {
      "t": "1878", "v": -1030
    },
    {
      "t": "1879", "v": -1590
    },
    {
      "t": "1880", "v": -1170
    },
    {
      "t": "1881", "v": -1730
    },
    {
      "t": "1882", "v": -190
    },
    {
      "t": "1883", "v": -930
    },
    {
      "t": "1884", "v": -1180
    },
    {
      "t": "1885", "v": -1940
    },
    {
      "t": "1886", "v": -1270
    },
    {
      "t": "1887", "v": -1900
    },
    {
      "t": "1888", "v": -3040
    },
    {
      "t": "1889", "v": -3830
    },
    {
      "t": "1890", "v": -2630
    },
    {
      "t": "1891", "v": -780
    },
    {
      "t": "1892", "v": -700
    },
    {
      "t": "1893", "v": -700
    },
    {
      "t": "1894", "v": -300
    },
    {
      "t": "1895", "v": -230
    },
    {
      "t": "1896", "v": 850
    },
    {
      "t": "1897", "v": 880
    },
    {
      "t": "1898", "v": 1510
    },
    {
      "t": "1899", "v": 2070
    },
    {
      "t": "1900", "v": 1410
    },
    {
      "t": "1901", "v": -830
    },
    {
      "t": "1902", "v": 100
    },
    {
      "t": "1903", "v": -460
    },
    {
      "t": "1904", "v": -360
    },
    {
      "t": "1905", "v": -800
    },
    {
      "t": "1906", "v": -10
    },
    {
      "t": "1907", "v": -620
    },
    {
      "t": "1908", "v": 0
    },
    {
      "t": "1909", "v": 0
    },
    {
      "t": "1910", "v": -460
    },
    {
      "t": "1911", "v": -680
    },
    {
      "t": "1912", "v": -180
    },
    {
      "t": "1913", "v": -200
    },
    {
      "t": "1914", "v": -2030
    },
    {
      "t": "1915", "v": -2580
    },
    {
      "t": "1916", "v": -2020
    },
    {
      "t": "1917", "v": 0
    },
    {
      "t": "1918", "v": 0,
      "h": "HIGHLIGHT",
      "label": "End of ww2"
    },
    {
      "t": "1919", "v": -1120
    },
    {
      "t": "1920", "v": -2540
    },
    {
      "t": "1921", "v": -1460
    },
    {
      "t": "1922", "v": -1000
    },
    {
      "t": "1923", "v": 3620
    },
    {
      "t": "1924", "v": 2790
    },
    {
      "t": "1925", "v": 1810
    },
    {
      "t": "1926", "v": 3620
    },
    {
      "t": "1927", "v": 2090
    },
    {
      "t": "1928", "v": 2690
    },
    {
      "t": "1929", "v": 3400
    },
    {
      "t": "1930", "v": 2550
    },
    {
      "t": "1931", "v": -2990
    },
    {
      "t": "1932", "v": -2710
    },
    {
      "t": "1933", "v": -1120
    },
    {
      "t": "1934", "v": -1400
    },
    {
      "t": "1935", "v": -1120
    },
    {
      "t": "1936", "v": 80
    },
    {
      "t": "1937", "v": 1700
    },
    {
      "t": "1938", "v": -40
    },
    {
      "t": "1939", "v": -3120
    },
    {
      "t": "1940", "v": -6340
    },
    {
      "t": "1941", "v": -2730
    },
    {
      "t": "1942", "v": -1460
    },
    {
      "t": "1943", "v": -1000
    },
    {
      "t": "1944", "v": -3620
    },
    {
      "t": "1945", "v": 2280
    },
    {
      "t": "1946", "v": 1950
    },
    {
      "t": "1947", "v": 3210
    },
    {
      "t": "1948", "v": 850
    },
    {
      "t": "1949", "v": 860
    },
    {
      "t": "1950", "v": 790
    },
    {
      "t": "1951", "v": 410
    },
    {
      "t": "1952", "v": 530
    },
    {
      "t": "1953", "v": 730
    },
    {
      "t": "1954", "v": 630
    },
    {
      "t": "1955", "v": 930
    },
    {
      "t": "1956", "v": 680
    },
    {
      "t": "1957", "v": 1360
    },
    {
      "t": "1958", "v": 1190
    },
    {
      "t": "1959", "v": 850
    },
    {
      "t": "1960", "v": 950
    },
    {
      "t": "1961", "v": 2400
    },
    {
      "t": "1962", "v": 2800
    },
    {
      "t": "1963", "v": 1620
    },
    {
      "t": "1964", "v": 3130
    },
    {
      "t": "1965", "v": 1760
    },
    {
      "t": "1966", "v": 650
    },
    {
      "t": "1967", "v": -390
    },
    {
      "t": "1968", "v": 660
    },
    {
      "t": "1969", "v": 1690
    },
    {
      "t": "1970", "v": 1040
    },
    {
      "t": "1971", "v": 5090
    },
    {
      "t": "1972", "v": 3230
    },
    {
      "t": "1973", "v": 4890
    },
    {
      "t": "1974", "v": 5090
    },
    {
      "t": "1975", "v": 3490
    },
    {
      "t": "1976", "v": 1040
    },
    {
      "t": "1977", "v": 830
    },
    {
      "t": "1978", "v": 720
    },
    {
      "t": "1979", "v": 1060
    },
    {
      "t": "1980", "v": 1340
    },
    {
      "t": "1981", "v": 440
    },
    {
      "t": "1982", "v": -320
    },
    {
      "t": "1983", "v": 40
    },
    {
      "t": "1984", "v": 480
    },
    {
      "t": "1985", "v": 970
    },
    {
      "t": "1986", "v": 1960
    },
    {
      "t": "1987", "v": 2000
    },
    {
      "t": "1988", "v": 2400
    },
    {
      "t": "1989", "v": 2857
    },
    {
      "t": "1990", "v": 3942
    },
    {
      "t": "1991", "v": 3958
    },
    {
      "t": "1992", "v": 4022
    },
    {
      "t": "1993", "v": 4012
    },
    {
      "t": "1994", "v": 3799
    },
    {
      "t": "1995", "v": 4336
    },
    {
      "t": "1996", "v": 3456
    },
    {
      "t": "1997", "v": 3634
    },
    {
      "t": "1998", "v": 3815
    },
    {
      "t": "1999", "v": 4461
    },
    {
      "t": "2000", "v": 3431
    },
    {
      "t": "2001", "v": 3310
    },
    {
      "t": "2002", "v": 2649
    },
    {
      "t": "2003", "v": 5450
    },
    {
      "t": "2004", "v": 4326
    },
    {
      "t": "2005", "v": 6150
    },
    {
      "t": "2006", "v": 5352
    },
    {
      "t": "2007", "v": 6001
    },
    {
      "t": "2008", "v": 7700
    },
    {
      "t": "2009", "v": 6583
    },
    {
      "t": "2010", "v": 7849
    },
    {
      "t": "2011", "v": 11004
    },
    {
      "t": "2012", "v": 10036
    },
    {
      "t": "2013", "v": 10348
    },
    {
      "t": "2014", "v": 11049
    }
  ]
}
