{
  "id": "d02-density-of-inhabitants",
  "title": "density of inhabitants",
  "timeformat": "YYYY-MM-dd",
  "legend": {
    "v": "people km2"
  },
  "values": [
    {
      "t": "1839", "tr": "1839-10-01",
      "v": 66,
      "l": "1821-01-01 was 52"
    },
    {
      "t": "1843", "tr": "1843-12-31",
      "v": 69
    },
    {
      "t": "1846", "tr": "1846-12-03",
      "v": 72
    },
    {
      "t": "1847", "tr": "1847-12-31",
      "v": 72
    },
    {
      "t": "1849", "tr": "1849-12-03",
      "v": 73
    },
    {
      "t": "1851", "tr": "1851-12-31",
      "v": 75
    },
    {
      "t": "1855", "tr": "1855-12-03",
      "v": 73
    },
    {
      "t": "1858", "tr": "1858-12-01",
      "v": 74
    },
    {
      "t": "1861", "tr": "1861-12-03",
      "v": 76
    },
    {
      "t": "1864", "tr": "1864-12-03",
      "v": 78
    },
    {
      "t": "1865", "tr": "1865-12-31",
      "v": 79
    },
    {
      "t": "1867", "tr": "1867-12-03",
      "v": 77,
      "h": "HIGHLIGHT",
      "l": "Pandemic?"
    },
    {
      "t": "1871", "tr": "1871-12-01",
      "v": 77
    },
    {
      "t": "1875", "tr": "1875-12-01",
      "v": 79
    },
    {
      "t": "1880", "tr": "1880-12-01",
      "v": 81
    },
    {
      "t": "1885", "tr": "1885-12-01",
      "v": 83
    },
    {
      "t": "1890", "tr": "1890-12-01",
      "v": 82
    },
    {
      "t": "1895", "tr": "1895-12-02",
      "v": 84
    },
    {
      "t": "1900", "tr": "1900-12-01",
      "v": 91
    },
    {
      "t": "1905", "tr": "1905-12-01",
      "v": 95
    },
    {
      "t": "1907", "tr": "1907-06-12",
      "v": 97
    },
    {
      "t": "1910", "tr": "1910-12-01",
      "v": 100
    },
    {
      "t": "1916", "tr": "1916-12-01",
      "v": 102
    },
    {
      "t": "1922", "tr": "1922-12-01",
      "v": 101
    },
    {
      "t": "1927", "tr": "1927-12-01",
      "v": 110
    },
    {
      "t": "1930", "tr": "1930-12-31",
      "v": 116,
      "h": "HIGHLIGHT",
      "l": "+16% in 10 years"
    },
    {
      "t": "1935", "tr": "1935-12-31",
      "v": 115
    },
    {
      "t": "1947", "tr": "1947-12-31",
      "v": 113
    },
    {
      "t": "1960", "tr": "1960-12-31",
      "v": 122
    },
    {
      "t": "1966", "tr": "1966-12-31",
      "v": 129
    },
    {
      "t": "1970", "tr": "1970-12-31",
      "v": 131
    },
    {
      "t": "1981", "tr": "1981-03-31",
      "v": 141
    },
    {
      "t": "1989", "tr": "1989-01-01",
      "v": 145
    }
  ]
}
