{
  "id": "d02-density-of-inhabitants",
  "title": "density-of-inhabitants",
  "timeformat": "YYYY-MM-dd",
  "legend": {
    "v": "people km2"
  },
  "values": [{
      "t": "1821-01-01",
      "v": 52
    },
    {
      "t": "1839-10-01",
      "v": 66
    },
    {
      "t": "1843-12-31",
      "v": 69
    },
    {
      "t": "1846-12-03",
      "v": 72
    },
    {
      "t": "1847-12-31",
      "v": 72
    },
    {
      "t": "1849-12-03",
      "v": 73
    },
    {
      "t": "1851-12-31",
      "v": 75
    },
    {
      "t": "1855-12-03",
      "v": 73
    },
    {
      "t": "1858-12-01",
      "v": 74
    },
    {
      "t": "1861-12-03",
      "v": 76
    },
    {
      "t": "1864-12-03",
      "v": 78
    },
    {
      "t": "1865-12-31",
      "v": 79
    },
    {
      "t": "1867-12-03",
      "v": 77
    },
    {
      "t": "1871-12-01",
      "v": 77
    },
    {
      "t": "1875-12-01",
      "v": 79
    },
    {
      "t": "1880-12-01",
      "v": 81
    },
    {
      "t": "1885-12-01",
      "v": 83
    },
    {
      "t": "1890-12-01",
      "v": 82
    },
    {
      "t": "1895-12-02",
      "v": 84
    },
    {
      "t": "1900-12-01",
      "v": 91
    },
    {
      "t": "1905-12-01",
      "v": 95
    },
    {
      "t": "1907-06-12",
      "v": 97
    },
    {
      "t": "1910-12-01",
      "v": 100
    },
    {
      "t": "1916-12-01",
      "v": 102
    },
    {
      "t": "1922-12-01",
      "v": 101
    },
    {
      "t": "1927-12-01",
      "v": 110
    },
    {
      "t": "1930-12-31",
      "v": 116
    },
    {
      "t": "1935-12-31",
      "v": 115
    },
    {
      "t": "1947-12-31",
      "v": 113
    },
    {
      "t": "1960-12-31",
      "v": 122
    },
    {
      "t": "1966-12-31",
      "v": 129
    },
    {
      "t": "1970-12-31",
      "v": 131
    },
    {
      "t": "1981-03-31",
      "v": 141
    },
    {
      "t": "1989-01-01",
      "v": 145
    }
  ]
}
