{
  "id": "trend-excess-arrivals-departures",
  "title": "excess of arrivals on departures",
  "timeformat": "YYYY",
  "legend": {
    "v": "people per year"
  },
  "values": [
    {"t": "1960", "v": 2025},
    {"t": "1961", "v": 2943},
    {"t": "1962", "v": 3345},
    {"t": "1963", "v": 1960},
    {"t": "1964", "v": 3960},
    {"t": "1965", "v": 4292},
    {"t": "1966", "v": 3309},
    {"t": "1966", "v":-389, "h": "HIGHLIGHT", "l": "Economic crisis"},
    {"t": "1968", "v": 660},
    {"t": "1969", "v": 1690},
    {"t": "1970", "v": 1091},
    {"t": "1971", "v": 5096},
    {"t": "1972", "v": 3243},
    {"t": "1973", "v": 4892},
    {"t": "1974", "v": 5090},
    {"t": "1975", "v": 3488},
    {"t": "1976", "v": 1054},
    {"t": "1977", "v": 816},
    {"t": "1978", "v": 615},
    {"t": "1979", "v": 1158},
    {"t": "1980", "v": 1359},
    {"t": "1981", "v": 406},
    {"t": "1982",	"v": -306, "h": "HIGHLIGHT", "l": "effect of Recession in the 80s (Oil crisis)"},
    {"t": "1983", "v": 32},
    {"t": "1984", "v": 488},
    {"t": "1985", "v": 824},
    {"t": "1986", "v": 1944},
    {"t": "1987", "v": 2396},
    {"t": "1988", "v": 3069},
    {"t": "1989", "v": 2857},
    {"t": "1990", "v": 3942},
    {"t": "1991", "v": 4173},
    {"t": "1992", "v": 4255},
    {"t": "1993", "v": 4243},
    {"t": "1994", "v": 4004},
    {"t": "1995", "v": 4610},
    {"t": "1996", "v": 3672},
    {"t": "1997", "v": 3832},
    {"t": "1998", "v": 4056},
    {"t": "1999", "v": 4719},
    {"t": "2000", "v": 3644},
    {"t": "2001", "v": 3311},
    {"t": "2002", "v": 2649},
    {"t": "2003", "v": 5412},
    {"t": "2004", "v": 4392},
    {"t": "2005", "v": 6110},
    {"t": "2006", "v": 5351},
    {"t": "2007", "v": 6001},
    {"t": "2008", "v": 7700},
    {"t": "2009", "v": 6583},
    {"t": "2010", "v": 7660}
  ]
}
    